{
  "cases": [
    {
      "id": "mask_straight",
      "metrics": {
        "mask_height": 0.3,
        "mask_sidewall_angle_deg": 0.0,
        "opening_cd_bottom": 0.3,
        "opening_cd_middle": 0.3,
        "opening_cd_top": 0.3
      },
      "step": "mask"
    },
    {
      "id": "mask_short",
      "metrics": {
        "mask_height": 0.2,
        "mask_sidewall_angle_deg": 0.0,
        "opening_cd_bottom": 0.3,
        "opening_cd_middle": 0.3,
        "opening_cd_top": 0.3
      },
      "step": "mask"
    },
    {
      "id": "mask_tapered",
      "metrics": {
        "mask_height": 0.3,
        "mask_sidewall_angle_deg": 3.814074834290351,
        "opening_cd_bottom": 0.302,
        "opening_cd_middle": 0.32,
        "opening_cd_top": 0.33399999999999996
      },
      "step": "mask"
    },
    {
      "id": "etch_straight",
      "metrics": {
        "cd_bottom": 0.3,
        "cd_max": 0.3,
        "cd_middle": 0.3,
        "cd_min": 0.3,
        "cd_top": 0.3,
        "depth": 1.0,
        "max_bow": 0.0,
        "max_cd_error": 0.0,
        "scallop_rms": 1.2542649920820667e-16,
        "sidewall_angle_deg": -0.0
      },
      "step": "bosch_etch"
    },
    {
      "id": "etch_shallow",
      "metrics": {
        "cd_bottom": 0.3,
        "cd_max": 0.3,
        "cd_middle": 0.3,
        "cd_min": 0.3,
        "cd_top": 0.3,
        "depth": 0.8,
        "max_bow": 0.0,
        "max_cd_error": 0.0,
        "scallop_rms": 3.820539449315626e-17,
        "sidewall_angle_deg": -0.0
      },
      "step": "bosch_etch"
    },
    {
      "id": "etch_tapered",
      "metrics": {
        "cd_bottom": 0.252,
        "cd_max": 0.312,
        "cd_middle": 0.28,
        "cd_min": 0.252,
        "cd_top": 0.312,
        "depth": 1.0,
        "max_bow": 2.7755575615628914e-17,
        "max_cd_error": 0.04799999999999999,
        "scallop_rms": 1.1368378764880023e-16,
        "sidewall_angle_deg": 2.2906100426385296
      },
      "step": "bosch_etch"
    },
    {
      "id": "etch_bowed",
      "metrics": {
        "cd_bottom": 0.31815961998958187,
        "cd_max": 0.33999999999999997,
        "cd_middle": 0.33999999999999997,
        "cd_min": 0.3123606797749979,
        "cd_top": 0.3123606797749979,
        "depth": 1.0,
        "max_bow": 0.012311129826705208,
        "max_cd_error": 0.03999999999999998,
        "scallop_rms": 0.00012017387945520529,
        "sidewall_angle_deg": -0.2215020964698561
      },
      "step": "bosch_etch"
    },
    {
      "id": "etch_narrow_neck",
      "metrics": {
        "cd_bottom": 0.29999961719060864,
        "cd_max": 0.299999990997186,
        "cd_middle": 0.21999999999999997,
        "cd_min": 0.21999999999999997,
        "cd_top": 0.299999990997186,
        "depth": 1.0,
        "max_bow": 0.03999989581683905,
        "max_cd_error": 0.08000000000000002,
        "scallop_rms": 0.009318121160977317,
        "sidewall_angle_deg": 1.4278359491244852e-05
      },
      "step": "bosch_etch"
    },
    {
      "id": "etch_scalloped",
      "metrics": {
        "cd_bottom": 0.30587785252292465,
        "cd_max": 0.3099802672842827,
        "cd_middle": 0.3,
        "cd_min": 0.2900197327157173,
        "cd_top": 0.29412214747707527,
        "depth": 1.0,
        "max_bow": 0.007458831701769697,
        "max_cd_error": 0.009980267284282696,
        "scallop_rms": 0.003451860326908368,
        "sidewall_angle_deg": -0.4490256632105237
      },
      "step": "bosch_etch"
    }
  ],
  "checks": {
    "bow_exceeds_straight_bow": true,
    "mask_taper_changes_top_vs_bottom_width": true,
    "neck_reduces_minimum_width": true,
    "scallops_increase_residual": true,
    "shallow_case_changes_depth": true,
    "short_mask_changes_height": true,
    "taper_changes_top_vs_bottom_width": true
  },
  "claim": "The legacy extractors respond to the large controlled contrasts, and the full-via wrapper distinguishes complete, out-of-domain, one-wall, absent-surface, and under-resolved states.",
  "does_not_prove": "Detection limits, numerical stability, physical calibration, or a process recipe.",
  "full_profile_controls": [
    {
      "id": "full_straight",
      "result": {
        "diagnostics": {
          "floor_candidates": [
            -1.0
          ],
          "mesh_bounds": {
            "x_max": 0.15,
            "x_min": -0.15,
            "y_max": -0.0,
            "y_min": -1.0
          },
          "minimum_width_cells": 30.0,
          "requested_y_range": [
            -0.85,
            -0.1
          ],
          "sample_count": 76,
          "samples_with_both_walls_in_domain": 76,
          "samples_with_both_walls_in_search": 76,
          "samples_with_left_wall": 76,
          "samples_with_right_wall": 76,
          "surface_intersections": [
            -0.15,
            0.15
          ]
        },
        "metrics": {
          "cd_bottom": 0.3,
          "cd_max": 0.3,
          "cd_middle": 0.3,
          "cd_min": 0.3,
          "cd_top": 0.3,
          "depth": 1.0,
          "max_bow": 0.0,
          "max_cd_error": 0.0,
          "maximum_center_shift": 0.0,
          "scallop_rms": 1.2542649920820667e-16,
          "sidewall_angle_deg": -0.0
        },
        "reason_codes": [],
        "state": "complete"
      }
    },
    {
      "id": "full_wide",
      "result": {
        "diagnostics": {
          "floor_candidates": [
            -1.0
          ],
          "mesh_bounds": {
            "x_max": 0.4,
            "x_min": -0.4,
            "y_max": -0.0,
            "y_min": -1.0
          },
          "minimum_width_cells": 80.0,
          "requested_y_range": [
            -0.85,
            -0.1
          ],
          "sample_count": 76,
          "samples_with_both_walls_in_domain": 76,
          "samples_with_both_walls_in_search": 76,
          "samples_with_left_wall": 76,
          "samples_with_right_wall": 76,
          "surface_intersections": [
            -0.4,
            0.4
          ]
        },
        "metrics": {
          "cd_bottom": 0.8,
          "cd_max": 0.8,
          "cd_middle": 0.8,
          "cd_min": 0.8,
          "cd_top": 0.8,
          "depth": 1.0,
          "max_bow": 0.0,
          "max_cd_error": 0.5,
          "maximum_center_shift": 0.0,
          "scallop_rms": 2.682703134521849e-16,
          "sidewall_angle_deg": -0.0
        },
        "reason_codes": [],
        "state": "complete"
      }
    },
    {
      "id": "full_wide_legacy_window",
      "result": {
        "diagnostics": {
          "floor_candidates": [
            -1.0
          ],
          "mesh_bounds": {
            "x_max": 0.4,
            "x_min": -0.4,
            "y_max": -0.0,
            "y_min": -1.0
          },
          "minimum_width_cells": null,
          "requested_y_range": [
            -0.85,
            -0.1
          ],
          "sample_count": 76,
          "samples_with_both_walls_in_domain": 76,
          "samples_with_both_walls_in_search": 0,
          "samples_with_left_wall": 76,
          "samples_with_right_wall": 76,
          "surface_intersections": [
            -0.4,
            0.4
          ]
        },
        "metrics": null,
        "reason_codes": [
          "walls_outside_declared_search_bounds"
        ],
        "state": "extractor_domain_failure"
      }
    },
    {
      "id": "full_one_wall",
      "result": {
        "diagnostics": {
          "floor_candidates": [
            -1.0
          ],
          "mesh_bounds": {
            "x_max": 0.0,
            "x_min": -0.15,
            "y_max": -0.0,
            "y_min": -1.0
          },
          "minimum_width_cells": null,
          "requested_y_range": [
            -0.85,
            -0.1
          ],
          "sample_count": 76,
          "samples_with_both_walls_in_domain": 0,
          "samples_with_both_walls_in_search": 0,
          "samples_with_left_wall": 76,
          "samples_with_right_wall": 0,
          "surface_intersections": [
            -0.15
          ]
        },
        "metrics": null,
        "reason_codes": [
          "one_full_via_wall_absent"
        ],
        "state": "valid_categorical_modeled_state"
      }
    },
    {
      "id": "declared_surface_absent",
      "result": {
        "diagnostics": {
          "floor_candidates": [],
          "mesh_bounds": {
            "x_max": 0.15,
            "x_min": -0.15,
            "y_max": -2.0,
            "y_min": -3.0
          },
          "minimum_width_cells": null,
          "requested_y_range": null,
          "sample_count": 76,
          "samples_with_both_walls_in_domain": 0,
          "samples_with_both_walls_in_search": 0,
          "samples_with_left_wall": 0,
          "samples_with_right_wall": 0,
          "surface_intersections": []
        },
        "metrics": null,
        "reason_codes": [
          "declared_wafer_surface_absent"
        ],
        "state": "out_of_scope_region"
      }
    },
    {
      "id": "two_cell_neck",
      "result": {
        "diagnostics": {
          "floor_candidates": [
            -1.0
          ],
          "mesh_bounds": {
            "x_max": 0.009,
            "x_min": -0.009,
            "y_max": -0.0,
            "y_min": -1.0
          },
          "minimum_width_cells": 1.7999999999999998,
          "requested_y_range": [
            -0.85,
            -0.1
          ],
          "sample_count": 76,
          "samples_with_both_walls_in_domain": 76,
          "samples_with_both_walls_in_search": 76,
          "samples_with_left_wall": 76,
          "samples_with_right_wall": 76,
          "surface_intersections": [
            -0.009,
            0.009
          ]
        },
        "metrics": null,
        "reason_codes": [
          "minimum_width_at_or_below_cell_threshold"
        ],
        "state": "insufficient_grid_representation"
      }
    }
  ],
  "schema_version": 2,
  "scope": "Synthetic geometry controls for measurement code; not simulated process outcomes.",